{
  "schema_version": "1.0.0",
  "incident_id": "INC-PILOT-008",
  "timestamp": "2026-10-13T13:00:04Z",
  "source": "synthetic-wazuh-fixture",
  "source_event_id": "EVT-PILOT-008",
  "description": "linux-01 audit 13:00:04Z add-user: local account lab-persist01 created, uid=2201; 13:00:06Z added to sudo group. Existing unapproved session actor=lab-temp. Owner confirmation: neither session nor new account is authorized. Session note recovered in the fixture says the account is intended to keep access after session expiry. New account remains enabled with sudo access; no network origin was recorded and no action has been applied.",
  "severity": "medium",
  "entities": [
    {
      "type": "host",
      "value": "linux-01"
    },
    {
      "type": "user",
      "value": "lab-persist01"
    }
  ],
  "ingestion_kind": "synthetic"
}
