{
  "schema_version": "1.0.0",
  "incident_id": "INC-8a6064bd-f310-5a68-9f66-1c868418d844",
  "timestamp": "2026-10-22T13:43:25.130000Z",
  "source": "wazuh:lab",
  "source_event_id": "1792676605.79530",
  "description": "Wazuh rule 5760 (level 5): sshd: authentication failed.\nManager: wazuh.manager; endpoint agent: linux-01 (001).\nObserved hostname: linuxsoc.\nConnection source IP: 192.168.77.30.\nEndpoint management IP: 192.168.56.20.\nDestination user: labtest.\nLog program: sshd.\nSource log: Oct 22 13:43:23 linuxsoc sshd[2164]: Failed password for labtest from 192.168.77.30 port 53212 ssh2",
  "severity": "low",
  "entities": [
    {
      "type": "host",
      "value": "linux-01"
    },
    {
      "type": "host",
      "value": "linuxsoc"
    },
    {
      "type": "ip",
      "value": "192.168.77.30"
    },
    {
      "type": "ip",
      "value": "192.168.56.20"
    },
    {
      "type": "user",
      "value": "labtest"
    },
    {
      "type": "process",
      "value": "sshd"
    }
  ],
  "ingestion_kind": "replay",
  "raw_event_ref": "infrastructure/soc-lab/evidence/lab01-run01-alert.json"
}
