{
  "schema_version": "1.0.0",
  "incident_id": "INC-PILOT-013",
  "timestamp": "2026-10-13T16:05:00Z",
  "source": "synthetic-wazuh-fixture",
  "source_event_id": "EVT-PILOT-013",
  "description": "linux-01 auth-fail-burst 16:05:00Z src=203.0.113.40 dst=10.77.0.20 protocol=tcp service=SSH account=lab-admin. 120 failed password logins during 16:00..16:05Z; uniformly paced at 24 attempts/minute, no successful login. Scanner allowlist SCAN-13: permitted source=203.0.113.40; destination=linux-01 (10.77.0.20); protocol=tcp; test type=SSH password-authentication failure checks; covered accounts=[lab-admin]; permitted window=15:55..16:10Z; limit=150 attempts per 5 minutes and 30 attempts/minute; successful authentication is outside the test scope. Full auth audit and service heartbeat available: no sessions or service impact.",
  "severity": "high",
  "entities": [
    {
      "type": "host",
      "value": "linux-01"
    },
    {
      "type": "ip",
      "value": "203.0.113.40"
    },
    {
      "type": "ip",
      "value": "10.77.0.20"
    },
    {
      "type": "user",
      "value": "lab-admin"
    }
  ],
  "ingestion_kind": "synthetic"
}
