{
  "schema_version": "1.0.0",
  "incident_id": "INC-PILOT-009",
  "timestamp": "2026-10-13T13:30:04Z",
  "source": "synthetic-wazuh-fixture",
  "source_event_id": "EVT-PILOT-009",
  "description": "linux-01 audit 13:30:04Z: lab-operator created local account lab-maint01 uid=2202 and added it to sudo. FIX-109 covers lab-operator, lab-maint01 and sudo membership during 13:25..13:40Z. Removal logged at 13:35Z; no unexpected sessions or service impact. Monitoring healthy.",
  "severity": "medium",
  "entities": [
    {
      "type": "host",
      "value": "linux-01"
    },
    {
      "type": "user",
      "value": "lab-maint01"
    }
  ],
  "ingestion_kind": "synthetic"
}
